<?xml version="1.0" encoding="UTF-8"?>
<n1:SyncCostCenter xmlns:n1="http://finance.group.volvo.com/costcenter/1_0" xmlns:xsi="http://www.w3.org/2001/XMLSchema-instance"
  xsi:schemaLocation="http://finance.group.volvo.com/costcenter/1_0 ../CostCenter_1_0.xsd">
  <Sync ReasonCode="Updates">
    <MessageHeader>
      <MsgVersion>1.0.0</MsgVersion>
      <Sender>
        <LogicalId>VGMF</LogicalId>
        <ComponentId>FIMCLNT100</ComponentId>
      </Sender>
      <CreationDateTime>2012-12-11T05:16:56Z</CreationDateTime>
    </MessageHeader>
  </Sync>
  <CostCenter>
    <BusinessObjectData>
      <Action>Create</Action>
    </BusinessObjectData>
    <CostCenterItem>
      <CostCenter>88888888</CostCenter>
      <ControllingArea>Z001</ControllingArea>
      <BusinessAreaShort>BC</BusinessAreaShort>
      <CostCenterDescription language="EN" defaultIndicator="true">
        <ShortText>Roadcrew General</ShortText>
        <LongText>Roadcrew General &amp; Administration</LongText>
      </CostCenterDescription>
      <EffectiveDatePeriod>
        <StartDate>2012-01-01</StartDate>
        <EndDate>9999-12-31</EndDate>
      </EffectiveDatePeriod>
      <CompanyCode>BR03</CompanyCode>
      <CostCenterCategory>Z</CostCenterCategory>
      <FunctionalArea>6020</FunctionalArea>
      <CurrencyCode>GBP</CurrencyCode>
      <ProfitCenter>0000010006</ProfitCenter>
      <StandardHierarchyNode>BC37435</StandardHierarchyNode>
      <PersonResponsibleName>Trevor Smith</PersonResponsibleName>
      <Place>GBWWK01</Place>
      <Market>GB</Market>
    </CostCenterItem>
  </CostCenter>
  <CostCenter>
    <BusinessObjectData>
      <Action>Create</Action>
    </BusinessObjectData>
    <CostCenterItem>
      <CostCenter>99999999</CostCenter>
      <ControllingArea>Z001</ControllingArea>
      <BusinessAreaShort>BC</BusinessAreaShort>
      <CostCenterDescription language="EN" defaultIndicator="true">
        <ShortText>Customer Solutions</ShortText>
        <LongText>Customer Solutions</LongText>
      </CostCenterDescription>
      <EffectiveDatePeriod>
        <StartDate>2012-01-01</StartDate>
        <EndDate>9999-12-31</EndDate>
      </EffectiveDatePeriod>
      <CompanyCode>BR03</CompanyCode>
      <CostCenterCategory>Z</CostCenterCategory>
      <FunctionalArea>7010</FunctionalArea>
      <CurrencyCode>GBP</CurrencyCode>
      <ProfitCenter>0000010051</ProfitCenter>
      <StandardHierarchyNode>BC24160</StandardHierarchyNode>
      <PersonResponsibleName>Paul Martin</PersonResponsibleName>
      <Place>GBRUG01</Place>
      <Market>GB</Market>
    </CostCenterItem>
  </CostCenter>
  <CostCenter>
    <BusinessObjectData>
      <Action>Update</Action>
    </BusinessObjectData>
    <CostCenterItem>
      <CostCenter>1230001110</CostCenter>
      <ControllingArea>Z001</ControllingArea>
      <BusinessAreaShort>BC</BusinessAreaShort>
      <CostCenterDescription language="EN" defaultIndicator="true">
        <ShortText>Updated_Short</ShortText>
        <LongText>Updated_Long</LongText>
      </CostCenterDescription>
      <EffectiveDatePeriod>
        <StartDate>2015-01-15</StartDate>
        <EndDate>2020-12-31</EndDate>
      </EffectiveDatePeriod>
      <CompanyCode>BR03</CompanyCode>
      <CostCenterCategory>Z</CostCenterCategory>
      <FunctionalArea>6010</FunctionalArea>
      <CurrencyCode>GBP</CurrencyCode>
      <ProfitCenter>0000010050</ProfitCenter>
      <StandardHierarchyNode>BC14401</StandardHierarchyNode>
      <PersonResponsibleName>Other, Simon</PersonResponsibleName>
      <PersonResponsibleUserId>someId</PersonResponsibleUserId>
      <Place>GBWWK01</Place>
      <Market>GB</Market>
    </CostCenterItem>
  </CostCenter>
  <CostCenter>
    <BusinessObjectData>
      <Action>Update</Action>
    </BusinessObjectData>
    <CostCenterItem>
      <CostCenter>1230006110</CostCenter>
      <ControllingArea>Z001</ControllingArea>
      <BusinessAreaShort>BC</BusinessAreaShort>
      <CostCenterDescription language="EN" defaultIndicator="true">
        <ShortText>Dlr Bus. Directors</ShortText>
        <LongText>Dealer Business Directors</LongText>
      </CostCenterDescription>
      <EffectiveDatePeriod>
        <StartDate>2015-01-01</StartDate>
        <EndDate>2020-12-31</EndDate>
      </EffectiveDatePeriod>
      <CompanyCode>BR03</CompanyCode>
      <CostCenterCategory>Z</CostCenterCategory>
      <FunctionalArea>6010</FunctionalArea>
      <CurrencyCode>GBP</CurrencyCode>
      <ProfitCenter>0000010001</ProfitCenter>
      <StandardHierarchyNode>BC37409</StandardHierarchyNode>
      <PersonResponsibleName>Joe Roddy</PersonResponsibleName>
      <Place>GBWWK01</Place>
      <Market>GB</Market>
    </CostCenterItem>
  </CostCenter>
  <CostCenter>
    <BusinessObjectData>
      <Action>Delete</Action>
    </BusinessObjectData>
    <CostCenterItem>
      <CostCenter>1230000905</CostCenter>
      <ControllingArea>Z001</ControllingArea>
      <BusinessAreaShort>BC</BusinessAreaShort>
      <CostCenterDescription language="EN" defaultIndicator="true">
        <ShortText>Customer Solutions</ShortText>
        <LongText>Customer Solutions</LongText>
      </CostCenterDescription>
      <EffectiveDatePeriod>
        <StartDate>2012-01-01</StartDate>
        <EndDate>9999-12-31</EndDate>
      </EffectiveDatePeriod>
      <CompanyCode>BR03</CompanyCode>
      <CostCenterCategory>Z</CostCenterCategory>
      <FunctionalArea>7010</FunctionalArea>
      <CurrencyCode>GBP</CurrencyCode>
      <ProfitCenter>0000010051</ProfitCenter>
      <StandardHierarchyNode>BC24160</StandardHierarchyNode>
      <PersonResponsibleName>Paul Martin</PersonResponsibleName>
      <Place>GBRUG01</Place>
      <Market>GB</Market>
    </CostCenterItem>
  </CostCenter>
</n1:SyncCostCenter>